"Input Title from EM","CrossRef API Status","CrossRef Title","DOI URL"
"Full-length single-cell RNA-seq applied to a viral human cancer: Applications to HPV expression and splicing analysis in HeLa S3 cells",ok,"Full-length single-cell RNA-seq applied to a viral human cancer: applications to HPV expression and splicing analysis in HeLa S3 cells",http://dx.doi.org/10.1186/s13742-015-0091-4
"RES-Scanner: a software package for genome-wide identification of RNA-editing sites",ok,"RES-Scanner: a software package for genome-wide identification of RNA-editing sites",http://dx.doi.org/10.1186/s13742-016-0143-4
"Species-level resolution of 16S rRNA gene amplicons sequenced through MinIONTM portable nanopore sequencer",ok,"Species-level resolution of 16S rRNA gene amplicons sequenced through the MinION™ portable nanopore sequencer",http://dx.doi.org/10.1186/s13742-016-0111-z
"Hybrid de novo genome assembly of the Chinese herbal plant danshen (Salvia miltiorrhiza Bunge)",ok,"Hybrid de novo genome assembly of the Chinese herbal plant danshen (Salvia miltiorrhiza Bunge)",http://dx.doi.org/10.1186/s13742-015-0104-3
"Fractal Self-similarity, Scale Invariance and Stationary waves Codes Architecture Human Chromosomes DNA sequences",ok,"G-Anchor: a novel approach for whole-genome comparative mapping utilizing evolutionary conserved DNA sequences",http://dx.doi.org/10.1093/gigascience/giy017
"Clusterflock: A Flocking Algorithm for Isolating Congruent Phylogenomic Datasets",ok,"Clusterflock: a flocking algorithm for isolating congruent phylogenomic datasets",http://dx.doi.org/10.1186/s13742-016-0152-3
"Mitochondrial Metagenomics: Letting the Genes out of the Bottle",ok,"Mitochondrial metagenomics: letting the genes out of the bottle",http://dx.doi.org/10.1186/s13742-016-0120-y
"Bioboxes - standardised containers for interchangeable bioinformatics software",ok,"Bioboxes: standardised containers for interchangeable bioinformatics software",http://dx.doi.org/10.1186/s13742-015-0087-0
